{"operation":"CONTENT_EXTRACTION","inputArtifact":{"artifactId":"00000000-0000-4000-8000-000000000102","artifactClass":"RAW","role":"INPUT","key":"raw/sha256/ff/ff/ffffffffffffffffffffffffffffffffffffffffffffffffffffffffffffffff/payload","mediaType":"text/html","byteLength":2048,"checksumAlgorithm":"SHA256","checksum":"ffffffffffffffffffffffffffffffffffffffffffffffffffffffffffffffff","immutable":true,"createdAt":"2026-07-15T00:00:00.000Z"},"outputStagingPrefix":"staging/00000000-0000-4000-8000-000000000302/00000000-0000-4000-8000-000000000402","profileId":"reference.html","profileVersion":"1.0.0","inputKind":"HTML","requestedFields":["TITLE","MAIN_CONTENT","LANGUAGE","DIRECTION"],"languageHints":["ar","en"],"textDirectionHint":"AUTO","extractLinks":true,"extractTables":true,"providerOptions":{}}
